{
  "brief_id": "brief-5f0e6b1f-33c4-4544-bfb1-40dffd83ffd6",
  "engagement_id": "engagement-e6655266-ab38-465a-a1f9-ac7095d9d1fd",
  "skill": "workflow-automation-review",
  "created_at": "2026-08-15T16:59:01.436Z",
  "client_name": "TechFlow Inc.",
  "client_objective": "Make our main lead-capture workflow 30% faster and more reliable",
  "current_situation": "We run a webhook-triggered n8n workflow that collects form submissions, validates them, enriches with company data via API, and logs to Pipedrive. It works, but often times out on large batches and sometimes loses data.",
  "desired_result": "A faster, more resilient workflow that can handle 500+ leads per day without timeouts or data loss. We want clear error handling and retry logic.",
  "scope": "Review and fix the existing workflow, apply one key optimization, and document the changes.",
  "out_of_scope": [
    "Complete rewrite of the workflow",
    "Integration with new platforms"
  ],
  "constraints": [
    "No downtime during the fix (we need the workflow running)",
    "Changes must be compatible with our existing Pipedrive setup"
  ],
  "source_materials": [
    {
      "name": "Lead workflow export",
      "type": "file",
      "location": "lead-workflow.json",
      "provenance": "Client export from n8n"
    },
    {
      "name": "Error log (last 7 days)",
      "type": "file",
      "location": "error-log.csv",
      "provenance": "Client export from n8n logs"
    }
  ],
  "access_provided": [
    {
      "system": "n8n",
      "scope": "read-only access to the workflow and logs",
      "expires_at": "2026-08-22T16:59:01.366Z"
    }
  ],
  "risks": [
    "The workflow handles sensitive lead data; changes must not compromise privacy",
    "Any timeout during the fix could cause duplicate leads; needs careful testing"
  ],
  "open_questions": [
    "Can we use a paid n8n node to improve performance, or must we stick to free nodes?",
    "What's the acceptable data latency for lead logging?"
  ],
  "success_criteria": [
    "Workflow can process 500+ leads without timeouts",
    "Error rate < 0.5%",
    "No data loss on any lead",
    "Changes are documented with rollback plan"
  ],
  "estimated_productive_time_minutes": 120,
  "approval_status": "pending_approval"
}